<?xml version="1.0" encoding="UTF-8"?>
<zalba xmlns:xsi="http://www.w3.org/2001/XMLSchema-instance"
    xsi:noNamespaceSchemaLocation="../xmlSchema/zalbanaodluku.xsd" datum="2020-12-05">
    <svrha>
        ЖАЛБА  ПРОТИВ  ОДЛУКЕ ОРГАНА  ВЛАСТИ КОЈОМ ЈЕ 
        ОДБИЈЕН ИЛИ ОДБАЧЕН ЗАХТЕВ ЗА ПРИСТУП ИНФОРМАЦИЈИ
    </svrha>
    <primalac naziv="Поверенику за информације од јавног значаја и заштиту података о личности">
        <adresa ulica="Булевар краља Александрa" broj="15">
            <mesto>Београд</mesto>
        </adresa>
    </primalac>
    
    Ж А Л Б А 
    
    <zalilac ime="i" prezime="p" xsi:type="Osoba">
        <adresa ulica="ulica" broj="1b">
            <mesto> </mesto>
        </adresa>
    </zalilac>
    против решења-закључка 
    
    <protiv broj="13/20" datum="2020-11-04">
        <donosilac naziv="naziv">
            <adresa ulica="ulica" broj="12">
                <mesto></mesto>
            </adresa>
        </donosilac>
    </protiv>
  
    Наведеном одлуком органа власти (решењем, закључком, обавештењем у писаној форми са елементима одлуке) , супротно закону, одбијен-одбачен је мој захтев који сам поднео/ла-упутио/ла дана <datum>2020-11-01</datum>
    године и тако ми ускраћено-онемогућено остваривање уставног и законског права на слободан приступ информацијама од јавног значаја. Oдлуку побијам
    <deo-pobijanja/> 
    јер није заснована на Закону о слободном приступу информацијама од јавног значаја.
    На основу изнетих разлога, предлажем да Повереник уважи моју жалбу,  поништи одлука првостепеног органа и омогући ми приступ траженој/им  информацији/ма.
    Жалбу подносим благовремено, у законском року утврђеном у члану 22. ст. 1. Закона о слободном приступу информацијама од јавног значаја.
    <zakon naziv="Закон о слободном приступу информацијама од јавног значаја">
        <clan broj="22">
            <stav broj="1"/>
        </clan>
    </zakon>
    
    <mesto> </mesto>
    
    <podnosilac ime="i" prezime="p">
        <adresa ulica="ulica" broj="23c">
            <mesto> </mesto>
        </adresa>
        <ostali-podaci> </ostali-podaci>
    </podnosilac>
</zalba>